[
  {
    "question": "Onde posso comprar publicações da Organização Mundial da Saúde?",
    "answer": "As publicações da Organização Mundial da Saúde podem ser compradas através do WHO Press, localizado na Organização Mundial da Saúde, 20 Avenue Appia, 1211 Geneva 27, Suíça.",
    "contexts": [
      "All rights reserved. Publications of the World Health Organization are available on the WHO web site (www.who.int) or can be purchased from WHO Press, World Health Organization, 20 Avenue Appia, 1211 Geneva 27, Switzerland (tel.: +41227913264; fax: +41227914857; e-mail: bookorders@who.int). Requests for permission to reproduce or translate WHO publications - whether for sale or for noncommercial distribution - should be addressed to WHO Press through the WHO web site",
      "ndex.html).",
      ".html)."
    ],
    "ground_truth": "As publicações da Organização Mundial da Saúde podem ser compradas através do WHO Press, localizado na Organização Mundial da Saúde, 20 Avenue Appia, 1211 Geneva 27, Suíça."
  },
  {
    "question": "Quem o WHO agradece pelo apoio técnico na elaboração da diretriz sobre ingestão de sódio?",
    "answer": "O WHO agradece aos membros do Subgrupo de Orientação Nutricional sobre Dieta e Saúde da WHO Nutrition Guidance Expert Advisory Group, bem como aos especialistas externos e pessoas de recursos.",
    "contexts": [
      "The World Health Organization (WHO) gratefully acknowledges the technical input and expert advice provided by the members of the WHO Nutrition Guidance Expert Advisory Group Subgroup on Diet and Health, and by the external experts and resource persons for the development of this guideline."
    ],
    "ground_truth": "O WHO agradece aos membros do Subgrupo de Orientação Nutricional sobre Dieta e Saúde da WHO Nutrition Guidance Expert Advisory Group, bem como aos especialistas externos e pessoas de recursos."
  },
  {
    "question": "Quem recebeu reconhecimento especial por suporte administrativo e logístico no departamento de Nutrição?",
    "answer": "M Emma Kennedy foi reconhecida especialmente por fornecer suporte administrativo e logístico.",
    "contexts": [
      "Special acknowledgment is made to M Emma Kennedy from the Nutrition Policy and Advice Department for providing administrative and logistic support."
    ],
    "ground_truth": "M Emma Kennedy foi reconhecida especialmente por fornecer suporte administrativo e logístico."
  }
]